source,date,title,documents,category,processed_text,sentiment_result,key_word
파이낸셜뉴스,2024.01.21. 오후 6:29,금융권 뒤덮은 홍콩發 공포… H지수 ELS 사실상 '스톱',"
대규모 원금손실 우려에 위축올 들어 246억원 발행 그쳐3년전 판매상품 올 속속 만기주저앉은 H지수에 불안 확산  홍콩 항셍중국기업지수(H지수)를 기초로 한 주가연계증권(ELS) 발행이 사실상 중지됐다.   21일 금융투자업계에 따르면 올해 들어 H지수를 기초로 한 ELS 발행금액은 246억원(20일 기준)에 그쳤다. 지난해 4월 발행 규모가 8300억원에 달했으나 H지수의 부진이 계속되면서 지난해 12월에는 1522억원으로 축소됐었다.   지난해 1월 H지수 기초 ELS 발행액은 1100억원가량이었다. 현재와 같은 흐름이 이어질 경우 올해 1월 H지수 기초 ELS 발행 규모는 지난해 같은 달의 4분의 1에 그칠 전망이다.   H지수를 기초자산으로 편입한 ELS의 가격조건이 충족되지 못하면서 상환받지 못하는 투자자들이 상당한 때문이다.   금융당국은 지난 2015년 H지수 급락 여파로 ELS 손실 우려가 커지자 구두 지침을 통해 2016년 11월부터 H지수를 기초로 한 ELS의 경우 전분기에 상환된 액수만큼만 발행토록 규제해왔다. 이에 따라 상환액이 많으면 새로운 분기가 시작되는 달에 신규 발행이 늘어날 수 있는 환경이 조성되곤 했다.   그러나 H지수 기초 ELS의 상환이 지면되면서 1월인데도 신규 발행은 200억원대에 그치고 있다. H지수 손실 공포가 금융권을 뒤덮고 있어서다.   ELS는 기초자산으로 삼은 지수 등에 연계돼 투자수익이 결정된다. 통상 6개월마다 기초자산 가격을 평가해 조기상환 기회를 주고, 만기 시 기초자산 가격이 일정 기준을 밑돌면 하락률만큼 원금손실이 발생한다.   홍콩 H지수는 2021년 2월 1만2000 선을 넘어섰으나 지금은 5100대로 내려온 상태다. 2022년 10월 말에는 5000 선이 무너지기도 했다.   문제는 H지수가 고점이던 2021년 판매된 상품들의 만기가 올해부터 속속 돌아온다는 점이다. 전체 잔액의 79.6%에 해당하는 15조4000억원의 만기가 연내 도래하는데 1·4분기 3조9000억원, 2·4분기 6조3000억원 등에 집중돼 있다.   코스피200지수를 기초로한 ELS 발행도 예전 같지 않다. 지난해 1월 발행금액은 7562억원가량이었으나 올해 들어서는 3423억원에 불과하다.   미국 스탠더드앤드푸어스(S&P)500지수를 기초로 한 ELS는 연초 이후 8045억원가량 발행됐다.   증권사들의 ELS 발행 위축은 자금 확보난으로 이어질 수 있다. 증권사들은 ELS와 회사채 발행으로 확보한 현금으로 기업 여신업무를 확대하고, 채권을 인수하는 데 주로 사용한다. H지수 ELS 파장이 커질 경우 증권사들이 자금조달에 어려움을 겪는 것은 물론 채권 발행시장 위축으로까지 이어질 수 있다는 지적이 나온다.  
",증권,"대규모 원금손실 우려에 위축올 들어 246억원 발행 그쳐3년전 판매상품 올 속속 만기주저앉은 H지수에 불안 확산  홍콩 항셍중국기업지수(H지수)를 기초로 한 주가연계증권(ELS) 발행이 사실상 중지됐다.   21일 금융투자업계에 따르면 올해 들어 H지수를 기초로 한 ELS 발행금액은 246억원(20일 기준)에 그쳤다. 지난해 4월 발행 규모가 8300억원에 달했으나 H지수의 부진이 계속되면서 지난해 12월에는 1522억원으로 축소됐었다.   지난해 1월 H지수 기초 ELS 발행액은 1100억원가량이었다. 현재와 같은 흐름이 이어질 경우 올해 1월 H지수 기초 ELS 발행 규모는 지난해 같은 달의 4분의 1에 그칠 전망이다.   H지수를 기초자산으로 편입한 ELS의 가격조건이 충족되지 못하면서 상환받지 못하는 투자자들이 상당한 때문이다.   금융당국은 지난 2015년 H지수 급락 여파로 ELS 손실 우려가 커지자 구두 지침을 통해 2016년 11월부터 H지수를 기초로 한 ELS의 경우 전분기에 상환된 액수만큼만 발행토록 규제해왔다. 이에 따라 상환액이 많으면 새로운 분기가 시작되는 달에 신규 발행이 늘어날 수 있는 환경이 조성되곤 했다.   그러나 H지수 기초 ELS의 상환이 지면되면서 1월인데도 신규 발행은 200억원대에 그치고 있다. H지수 손실 공포가 금융권을 뒤덮고 있어서다.   ELS는 기초자산으로 삼은 지수 등에 연계돼 투자수익이 결정된다. 통상 6개월마다 기초자산 가격을 평가해 조기상환 기회를 주고, 만기 시 기초자산 가격이 일정 기준을 밑돌면 하락률만큼 원금손실이 발생한다.   홍콩 H지수는 2021년 2월 1만2000 선을 넘어섰으나 지금은 5100대로 내려온 상태다. 2022년 10월 말에는 5000 선이 무너지기도 했다.   문제는 H지수가 고점이던 2021년 판매된 상품들의 만기가 올해부터 속속 돌아온다는 점이다. 전체 잔액의 79.6%에 해당하는 15조4000억원의 만기가 연내 도래하는데 1·4분기 3조9000억원, 2·4분기 6조3000억원 등에 집중돼 있다.   코스피200지수를 기초로한 ELS 발행도 예전 같지 않다. 지난해 1월 발행금액은 7562억원가량이었으나 올해 들어서는 3423억원에 불과하다.   미국 스탠더드앤드푸어스(S&P)500지수를 기초로 한 ELS는 연초 이후 8045억원가량 발행됐다.   증권사들의 ELS 발행 위축은 자금 확보난으로 이어질 수 있다. 증권사들은 ELS와 회사채 발행으로 확보한 현금으로 기업 여신업무를 확대하고, 채권을 인수하는 데 주로 사용한다. H지수 ELS 파장이 커질 경우 증권사들이 자금조달에 어려움을 겪는 것은 물론 채권 발행시장 위축으로까지 이어질 수 있다는 지적이 나온다.",negative,[]
한국경제,2024.01.21. 오후 6:26,3주째 힘 못쓰는 코스피…훨훨 나는 美·日 증시와 딴판,"
올들어 6.8% 하락Fed 금리인하 기대 후퇴北 등 지정학 위험 고조中 경기 침체도 한몫코스피지수가 3주 연속 하락하면서 사상 최고치를 기록한 선진국 증시와의 격차가 더 벌어졌다. 미국 기준금리 조기 인하 기대 후퇴, 지정학적 위험 증가, 중국 경기 악화 등의 이유로 당분간 추세적 반등은 어려울 것이란 전망이 많다.



21일 한국거래소에 따르면 코스피지수는 올 들어 6.87% 하락했다. 지난 19일 1.34% 오르며 2472.74에 장을 마쳤지만 분위기는 좋지 않다. 코스피지수는 올 들어 3주 연속 하락세를 이어가고 있다. 글로벌 대표 지수 움직임과 대비된다. 미국 S&P500지수는 지난주 1.17% 상승해 사상 최고치를 기록하고, 일본 닛케이225지수가 1.09% 올라 버블 붕괴 이후 사상 최고치에 근접했다.코스피지수가 떨어지는 건 미국 기준금리 조기 인하 기대가 식으면서 외국인이 신흥국 증시에서 돈을 빼고 있기 때문으로 풀이된다. 시카고상품거래소(CME) 페드워치에 따르면 미국 중앙은행(Fed)의 3월 기준금리 인하 가능성은 12일 76.90%를 찍은 뒤 최근에는 40%대로 떨어졌다. 이 영향으로 지난주 MSCI 선진국지수가 0.22% 올랐지만 MSCI 신흥국지수는 2.55% 급락했다. 신흥국으로 분류되는 한국의 코스피지수도 조정받았다. 외국인은 올 들어 유가증권시장에서 약 8000억원어치(삼성그룹 주식 블록딜 제외)의 주식 현물과 5조7180억원어치의 코스피200 선물을 순매도했다.중동 홍해, 북한 등과 관련해 지정학적 긴장이 고조되는 것도 코스피지수가 떨어지는 원인 가운데 하나로 지적된다. 원유 수입의 약 3분의 2를 중동에 의존하는 만큼 현지 분쟁에 취약하다.정용택 IBK투자증권 리서치센터장은 “일본에서는 정부가 연금계좌 세제 혜택을 확대한다는 정책을 연초 발표하면서 개인의 주식 매수세가 커졌고, 엔저 현상도 외국인 자금 유입에 긍정적 영향을 미치고 있다”며 “대만은 증시 전체 시가총액의 약 절반을 차지하는 TSMC가 어닝서프라이즈를 냈지만 삼성전자는 어닝쇼크 상황인 점도 코스피지수 하락폭을 키웠다”고 했다.전문가들은 당분간 코스피지수의 추세적 반등을 보기는 어려울 것으로 전망했다. 이재선 현대차증권 연구원은 “코스피지수가 상승 반전하려면 중국 경기가 돌아서야 하는데 아직 그런 지표는 나오지 않고 있다”고 했다.박소연 신영증권 연구원은 “이달 말(30~31일) Fed의 올해 첫 연방공개시장위원회(FOMC) 정례회의가 열릴 예정이어서 큰 폭의 반등보다는 관망 분위기가 나타날 것”이라고 했다.
",증권,"올들어 6.8% 하락Fed 금리인하 기대 후퇴北 등 지정학 위험 고조中 경기 침체도 한몫코스피지수가 3주 연속 하락하면서 사상 최고치를 기록한 선진국 증시와의 격차가 더 벌어졌다. 미국 기준금리 조기 인하 기대 후퇴, 지정학적 위험 증가, 중국 경기 악화 등의 이유로 당분간 추세적 반등은 어려울 것이란 전망이 많다.21일 한국거래소에 따르면 코스피지수는 올 들어 6.87% 하락했다. 지난 19일 1.34% 오르며 2472.74에 장을 마쳤지만 분위기는 좋지 않다. 코스피지수는 올 들어 3주 연속 하락세를 이어가고 있다. 글로벌 대표 지수 움직임과 대비된다. 미국 S&P500지수는 지난주 1.17% 상승해 사상 최고치를 기록하고, 일본 닛케이225지수가 1.09% 올라 버블 붕괴 이후 사상 최고치에 근접했다.코스피지수가 떨어지는 건 미국 기준금리 조기 인하 기대가 식으면서 외국인이 신흥국 증시에서 돈을 빼고 있기 때문으로 풀이된다. 시카고상품거래소(CME) 페드워치에 따르면 미국 중앙은행(Fed)의 3월 기준금리 인하 가능성은 12일 76.90%를 찍은 뒤 최근에는 40%대로 떨어졌다. 이 영향으로 지난주 MSCI 선진국지수가 0.22% 올랐지만 MSCI 신흥국지수는 2.55% 급락했다. 신흥국으로 분류되는 한국의 코스피지수도 조정받았다. 외국인은 올 들어 유가증권시장에서 약 8000억원어치(삼성그룹 주식 블록딜 제외)의 주식 현물과 5조7180억원어치의 코스피200 선물을 순매도했다.중동 홍해, 북한 등과 관련해 지정학적 긴장이 고조되는 것도 코스피지수가 떨어지는 원인 가운데 하나로 지적된다. 원유 수입의 약 3분의 2를 중동에 의존하는 만큼 현지 분쟁에 취약하다.정용택 IBK투자증권 리서치센터장은 “일본에서는 정부가 연금계좌 세제 혜택을 확대한다는 정책을 연초 발표하면서 개인의 주식 매수세가 커졌고, 엔저 현상도 외국인 자금 유입에 긍정적 영향을 미치고 있다”며 “대만은 증시 전체 시가총액의 약 절반을 차지하는 TSMC가 어닝서프라이즈를 냈지만 삼성전자는 어닝쇼크 상황인 점도 코스피지수 하락폭을 키웠다”고 했다.전문가들은 당분간 코스피지수의 추세적 반등을 보기는 어려울 것으로 전망했다. 이재선 현대차증권 연구원은 “코스피지수가 상승 반전하려면 중국 경기가 돌아서야 하는데 아직 그런 지표는 나오지 않고 있다”고 했다.박소연 신영증권 연구원은 “이달 말(30~31일) Fed의 올해 첫 연방공개시장위원회(FOMC) 정례회의가 열릴 예정이어서 큰 폭의 반등보다는 관망 분위기가 나타날 것”이라고 했다.",negative,[]
한국경제,2024.01.21. 오후 6:26,"변동성 장세엔 수익률 방어 최우선…""한화에어로·현대로템 방산주 주목""","
증권사 추천 종목지정학적 리스크를투자 기회로 삼아야 2분기엔 AI·인터넷株소비재도 반등할 것코스피지수가 새해 6% 넘게 하락하자 증권사들은 수익률 방어가 가능한 종목으로 포트폴리오를 꾸릴 필요가 있다고 조언하고 있다.21일 한국경제신문이 삼성 NH투자 한국투자 KB 키움 등 5개 주요 증권사 리서치센터를 대상으로 1분기 변동성 국면에 대처할 수 있는 종목을 추천받은 결과다.방산주 추천이 많았다. 지정학적 리스크를 투자 기회로 삼아야 한다는 조언이다. 키움증권은 한화에어로스페이스 현대로템 LIG넥스원을 추천했다. 한국투자증권은 한화에어로스페이스, KB증권은 한화시스템을 추천 종목으로 꼽았다.한화에어로스페이스는 연초 이후 19일까지 16.1%, 한국항공우주(KAI)는 10.8%, 한화시스템은 7.3% 올랐다. 현대로템은 0.5% 하락하는 데 그쳐 코스피지수 대비 선방했다. LIG넥스원은 지난달 급등 여파로 올해 6.9% 내려가며 비교적 부진했다. KB증권은 “우주항공과 관련한 정부 예산 확대와 우주항공청 설립 등 정책적 수혜도 기대해볼 수 있다”고 했다.변동성 국면이 지난 2분기에 주목해야 할 업종으로는 AI와 인터넷이 가장 많이 꼽혔다. KB증권은 “올해 중반부터는 금리 인하 등의 영향으로 소비재도 반등할 것”이라며 “반도체 등 경기민감주 강세 상황에서 AI와 같은 주도주들이 더 돋보일 것”이라고 했다. NH투자증권도 “올해는 AI가 본격 상용화 서비스로 등장하게 될 것”이라며 “AI 관련 소비자 시장과 기업 시장에서 모두 돈을 벌 수 있는 네이버를 주목해야 한다”고 했다.반도체 주식도 빠지지 않았다. 리서치센터 다섯 곳 중 네 곳이 삼성전자를 추천 종목으로 꼽았다. 올 들어 삼성전자는 4.8% 하락했지만 글로벌 경기가 본격 회복되면 주가가 우상향할 것이라는 게 전문가들 예상이다. NH투자증권은 “올 하반기 전반적인 메모리 가격 회복과 함께 밸류에이션(실적 대비 주가 수준) 매력이 부각될 것”이라고 했다.
",증권,"증권사 추천 종목지정학적 리스크를투자 기회로 삼아야 2분기엔 AI·인터넷株소비재도 반등할 것코스피지수가 새해 6% 넘게 하락하자 증권사들은 수익률 방어가 가능한 종목으로 포트폴리오를 꾸릴 필요가 있다고 조언하고 있다.21일 한국경제신문이 삼성 NH투자 한국투자 KB 키움 등 5개 주요 증권사 리서치센터를 대상으로 1분기 변동성 국면에 대처할 수 있는 종목을 추천받은 결과다.방산주 추천이 많았다. 지정학적 리스크를 투자 기회로 삼아야 한다는 조언이다. 키움증권은 한화에어로스페이스 현대로템 LIG넥스원을 추천했다. 한국투자증권은 한화에어로스페이스, KB증권은 한화시스템을 추천 종목으로 꼽았다.한화에어로스페이스는 연초 이후 19일까지 16.1%, 한국항공우주(KAI)는 10.8%, 한화시스템은 7.3% 올랐다. 현대로템은 0.5% 하락하는 데 그쳐 코스피지수 대비 선방했다. LIG넥스원은 지난달 급등 여파로 올해 6.9% 내려가며 비교적 부진했다. KB증권은 “우주항공과 관련한 정부 예산 확대와 우주항공청 설립 등 정책적 수혜도 기대해볼 수 있다”고 했다.변동성 국면이 지난 2분기에 주목해야 할 업종으로는 AI와 인터넷이 가장 많이 꼽혔다. KB증권은 “올해 중반부터는 금리 인하 등의 영향으로 소비재도 반등할 것”이라며 “반도체 등 경기민감주 강세 상황에서 AI와 같은 주도주들이 더 돋보일 것”이라고 했다. NH투자증권도 “올해는 AI가 본격 상용화 서비스로 등장하게 될 것”이라며 “AI 관련 소비자 시장과 기업 시장에서 모두 돈을 벌 수 있는 네이버를 주목해야 한다”고 했다.반도체 주식도 빠지지 않았다. 리서치센터 다섯 곳 중 네 곳이 삼성전자를 추천 종목으로 꼽았다. 올 들어 삼성전자는 4.8% 하락했지만 글로벌 경기가 본격 회복되면 주가가 우상향할 것이라는 게 전문가들 예상이다. NH투자증권은 “올 하반기 전반적인 메모리 가격 회복과 함께 밸류에이션(실적 대비 주가 수준) 매력이 부각될 것”이라고 했다.",negative,[]
한국경제,2024.01.21. 오후 6:25,콘텐츠株 희비…웹소설 '꿀잼' 드라마 '노잼',"
스튜디오드래곤콘텐트리중앙 등실적 우려에 목표가 하향디앤씨미디어는올들어 38% 급등밀리도 반등 조짐증권가에서 드라마 영화 등을 제작하는 콘텐츠기업의 목표주가를 낮추고 있다. 지난해에 이어 올해도 실적이 부진할 것이란 전망에서다. 웹툰 웹소설 등을 기반으로 하는 콘텐츠기업의 주가가 상승세를 타는 것과 대비되는 모습이다.21일 증권업계에 따르면 DB금융투자는 지난 19일 드라마 제작사인 스튜디오드래곤의 목표가를 7만5000원에서 6만6000원으로 12% 낮췄다. 지난해 4분기 실적이 기존 추정치보다 좋지 않을 것으로 예상되면서다. 신은정 DB금융투자 연구원은 “드라마 방영 회차가 줄어들고, 상각비 부담이 커졌다”며 “올해 연간 작품 수도 지난해 대비 소폭 축소될 수 있다”고 설명했다.하나증권도 지난주 스튜디오드래곤과 콘텐트리중앙의 목표주가를 내렸다. 스튜디오드래곤은 7만원에서 6만5000원으로, 콘텐트리중앙은 2만4000원에서 2만1000원으로 조정했다. 이기훈 하나증권 연구원은 “콘텐트리중앙의 예상 영업적자가 243억원으로 시장 전망(35억원 적자)보다 클 것”이라며 “‘서울의 봄’ 관련 배급·투자수익이 일부 반영되나 4분기는 3분기 개봉작의 부진으로 영향이 제한적일 것”이라고 분석했다.스튜디오드래곤과 콘텐트리중앙 주가도 하락세다. 스튜디오드래곤 주가는 올 들어 12.33% 떨어졌다. 같은 기간 콘텐트리중앙 주가도 15.33% 내려갔다.웹소설과 웹툰 관련주는 올해 강세를 보이고 있다. 디앤씨미디어 주가는 올 들어 38.64% 올랐다. 올해 글로벌 론칭한 ‘나 혼자만 레벨업(나혼렙)’ 애니메이션이 인기를 끌면서 지식재산권(IP)을 보유한 디앤씨미디어가 주목을 받았다. 상반기에는 넷마블에서 액션 역할수행게임(RPG) ‘나 혼자만 레벨업: ARISE’가 출시될 예정이다. 전자책 구독 플랫폼기업인 밀리의서재도 올 들어 저점 매수세가 유입되면서 87.24% 급등했다.김회재 대신증권 연구원은 “올해 광고 전망을 확인하기 전까지는 영상 콘텐츠 기업의 부진한 주가 흐름이 이어질 전망”이라며 “광고시장 분위기가 개선되고 있고, 최근 콘텐츠 성과도 양호해 4분기 실적 확인 후에는 주가가 상승할 수 있다”고 말했다.
",증권,"스튜디오드래곤콘텐트리중앙 등실적 우려에 목표가 하향디앤씨미디어는올들어 38% 급등밀리도 반등 조짐증권가에서 드라마 영화 등을 제작하는 콘텐츠기업의 목표주가를 낮추고 있다. 지난해에 이어 올해도 실적이 부진할 것이란 전망에서다. 웹툰 웹소설 등을 기반으로 하는 콘텐츠기업의 주가가 상승세를 타는 것과 대비되는 모습이다.21일 증권업계에 따르면 DB금융투자는 지난 19일 드라마 제작사인 스튜디오드래곤의 목표가를 7만5000원에서 6만6000원으로 12% 낮췄다. 지난해 4분기 실적이 기존 추정치보다 좋지 않을 것으로 예상되면서다. 신은정 DB금융투자 연구원은 “드라마 방영 회차가 줄어들고, 상각비 부담이 커졌다”며 “올해 연간 작품 수도 지난해 대비 소폭 축소될 수 있다”고 설명했다.하나증권도 지난주 스튜디오드래곤과 콘텐트리중앙의 목표주가를 내렸다. 스튜디오드래곤은 7만원에서 6만5000원으로, 콘텐트리중앙은 2만4000원에서 2만1000원으로 조정했다. 이기훈 하나증권 연구원은 “콘텐트리중앙의 예상 영업적자가 243억원으로 시장 전망(35억원 적자)보다 클 것”이라며 “‘서울의 봄’ 관련 배급·투자수익이 일부 반영되나 4분기는 3분기 개봉작의 부진으로 영향이 제한적일 것”이라고 분석했다.스튜디오드래곤과 콘텐트리중앙 주가도 하락세다. 스튜디오드래곤 주가는 올 들어 12.33% 떨어졌다. 같은 기간 콘텐트리중앙 주가도 15.33% 내려갔다.웹소설과 웹툰 관련주는 올해 강세를 보이고 있다. 디앤씨미디어 주가는 올 들어 38.64% 올랐다. 올해 글로벌 론칭한 ‘나 혼자만 레벨업(나혼렙)’ 애니메이션이 인기를 끌면서 지식재산권(IP)을 보유한 디앤씨미디어가 주목을 받았다. 상반기에는 넷마블에서 액션 역할수행게임(RPG) ‘나 혼자만 레벨업: ARISE’가 출시될 예정이다. 전자책 구독 플랫폼기업인 밀리의서재도 올 들어 저점 매수세가 유입되면서 87.24% 급등했다.김회재 대신증권 연구원은 “올해 광고 전망을 확인하기 전까지는 영상 콘텐츠 기업의 부진한 주가 흐름이 이어질 전망”이라며 “광고시장 분위기가 개선되고 있고, 최근 콘텐츠 성과도 양호해 4분기 실적 확인 후에는 주가가 상승할 수 있다”고 말했다.",neutral,[]
한국경제,2024.01.21. 오후 6:24,"큰손들, 에코프로 저가 줍줍…삼성전자·셀트리온·펩트론도","
마켓PRO 부자들의 투자종목대형 증권사 고액 자산가들이 지난주 2차전지와 반도체 관련주를 집중 매수했다.21일 한국투자증권에 따르면 이 증권사 계좌의 평균 잔액이 10억원 이상인 사람들은 지난 12~19일 2차전지 관련주인 에코프로를 123억7000만원어치 사들였다. 이 기간 순매수액 1위다. 에코프로가 지난주 14.33% 하락하자 저점 매수를 노린 것으로 풀이된다. 리튬 가격이 한 해 전보다 80% 넘게 떨어지며 수익성 하락 우려로 에코프로 주가는 2개월 만의 최저 수준까지 떨어졌다.자산가들은 지난주 삼성전자도 대거 사들였다. 9일 삼성전자는 작년 4분기 잠정 실적을 발표했다. 연결 기준 매출 67조원, 영업이익 2조8000억원으로 전년 동기 대비 각각 4.9%, 35.0% 감소했지만 올해 반등 기대가 높다. 반도체 주식뿐 아니라 인공지능(AI) 관련주도 사들였다.미래에셋증권 계좌를 사용하는 투자 고수(수익률 상위 1%)들이 지난주 가장 많이 매수한 종목은 셀트리온이었다. 비만치료제 관련주인 펩트론도 대거 사들였다.
",증권,"마켓PRO 부자들의 투자종목대형 증권사 고액 자산가들이 지난주 2차전지와 반도체 관련주를 집중 매수했다.21일 한국투자증권에 따르면 이 증권사 계좌의 평균 잔액이 10억원 이상인 사람들은 지난 12~19일 2차전지 관련주인 에코프로를 123억7000만원어치 사들였다. 이 기간 순매수액 1위다. 에코프로가 지난주 14.33% 하락하자 저점 매수를 노린 것으로 풀이된다. 리튬 가격이 한 해 전보다 80% 넘게 떨어지며 수익성 하락 우려로 에코프로 주가는 2개월 만의 최저 수준까지 떨어졌다.자산가들은 지난주 삼성전자도 대거 사들였다. 9일 삼성전자는 작년 4분기 잠정 실적을 발표했다. 연결 기준 매출 67조원, 영업이익 2조8000억원으로 전년 동기 대비 각각 4.9%, 35.0% 감소했지만 올해 반등 기대가 높다. 반도체 주식뿐 아니라 인공지능(AI) 관련주도 사들였다.미래에셋증권 계좌를 사용하는 투자 고수(수익률 상위 1%)들이 지난주 가장 많이 매수한 종목은 셀트리온이었다. 비만치료제 관련주인 펩트론도 대거 사들였다.",neutral,[]
