source,date,title,documents,category,processed_text,sentiment_result,key_word
비즈워치,2024.01.21. 오후 3:00,갤럭시S24 신무기 'AI' 톺아보기,"
[테크따라잡기]'첫 AI폰' 갤럭시S24, 통화·메시지·노트 등 여러 AI 기능 더해져



/그래픽=비즈워치삼성전자가 지난 18일 상반기 플래그십 스마트폰 '갤럭시 S24' 시리즈를 선보였죠. 삼성전자의 갤럭시 신제품 공개는 늘 화제가 되지만, 올해는 조금 특별했던 것 같습니다. 갤럭시S24가 최초의 'AI(인공지능) 스마트폰'을 표방했기 때문인데요.갤럭시S24는 삼성전자가 자체 개발한 '갤럭시 AI'가 탑재된 첫 스마트폰입니다. 이전까지 갤럭시 시리즈에 AI 기능이 없던 건 아니지만, 올해는 조금 더 획기적으로 개선된 모습이었는데요. 이번 주 테크따라잡기는 갤럭시S24의 AI 기능을 구체적으로 살펴보겠습니다.



갤럭시S24 시리즈. 왼쪽부터 순서대로 울트라·플러스·일반 모델./사진=백유진 기자 byj@내 손안의 통역사갤럭시 AI의 가장 대표적인 역할은 '통역사'입니다. 삼성전자는 제품 공개에 앞서 이 기능을 선공개한 바 있는데요. 바로 '양방향 통역 서비스'입니다.통역 서비스는 통화와 메시지 모두 가능합니다. 삼성 기본 전화 앱(App)으로 전화를 걸면 통화 어시스트 버튼이 뜨고요. 여기서 실시간 통역을 누르면, 이 통화는 '실시간으로 번역되며 화면에 텍스트로 표시됩니다'라는 안내와 함께 통역이 시작됩니다.실제 삼성전자가 시연하는 것을 보니, 화자가 한국어로 얘기를 하면 영어로 자연스럽게 번역이 되더군요. 수신자에게는 발신자가 말하는 한국어가 영어로 통역돼 들린다고 합니다. 상대방의 스마트폰 기종이 갤럭시가 아닌 아이폰이어도 상관없다고 하고요. 다만 아직은 삼성 기본 전화 앱을 통해서만 가능하다고 하네요.



갤럭시S24에서 한국어로 메시지를 입력하니 자동으로 스페인어로 번역됐다./영상=백유진 기자 byj@이와 달리 메시지 기능은 삼성 기본 메시지 앱이 아닌 카카오톡 같은 서드파티 앱에서도 활용 가능합니다. 메시지 번역 기능이 갤럭시 스마트폰에 기본 탑재된 '삼성 키보드'를 통해 구동되기 때문인데요.삼성 키보드에 새로 생긴 AI 버튼을 누르면 △대화 번역 △문장 스타일 △철자 및 문법 메뉴가 나옵니다. 여기서 대화 번역을 누르면 한국어로 입력한 문장이 자동으로 번역이 됩니다. 갤럭시로 통·번역 가능한 언어는 한국어를 비롯해 △중국어(간체) △영어 △프랑스어 △독일어 △힌디어 △이탈리아어 △일본어 △폴란드어 △포르투갈어 △스페인어 △태국어 △베트남어 등 13개입니다.



갤럭시S24에서 삼성 키보드로 문구를 입력하면, 5가지 형태로 문장 스타일을 변경할 수 있다./영상=백유진 기자 byj@이뿐 아니라 메시지 내 문장 스타일을 바꿀 수도 있는데요. 원하는 내용을 작성한 뒤 문장 스타일을 누르면 갤럭시 AI가 △전문적인 △편안한 △소셜 △공손한 △이모지 추가 등 총 5가지 버전의 문장을 만들어줍니다. 소셜을 선택하면 SNS에 올리기 쉽도록 태그가 자동으로 달리고요, 이모지를 추가하면 내용에 맞는 적절한 이모티콘이 추가되는 식입니다.검색·편집도 'AI'가장 눈에 띄었던 기능은 '서클 투 서치'입니다. 이는 삼성전자와 구글과의 협력으로 탄생한 AI 기능인데요. 어느 화면에나 궁금한 부분에 동그라미를 그리면 갤럭시 AI는 이를 인식해 구글 검색으로 연동시켜 줍니다. 스마트폰을 사용하다가 궁금한 게 생겨도 검색창을 켜지 않고 해결이 가능해진 거죠.



갤럭시S24에서 유튜브를 보다 캐릭터를 동그라미치니 자동으로 구글 검색이 됐다./영상=백유진 기자 byj@검색 내용도 AI가 가장 적합한 정보를 우선적으로 보여줍니다. 추가로 궁금한 게 있다면 AI에게 대화형으로 질문할 수도 있습니다. 이 역시 생성형 AI가 정리한 정보로 보여주죠. 예를 들어 볼까요? 인스타그램을 보다가 가고 싶은 랜드마크를 발견했는데, 장소 태그가 돼 있지 않은 경우가 있죠. 이럴 때 이미지에 동그라미를 치는 것만으로 랜드마크의 명칭과 위치를 알 수 있습니다. 이후 대화를 통해 후속 질문을 이어가며 해당 장소의 역사적 의미 등을 파악할 수 있죠.



갤럭시S24로 삼성 노트에서 글을 편집하는 모습. '제목 및 글머리 기호'를 누르니 여러 서식이 만들어졌다./영상=백유진 기자 byj@'삼성 노트'에도 AI가 적용되며 여러 기능이 생겼는데요. 이중에서는 자동 서식을 맞춰주는 기능이 가장 새로웠습니다. 삼성 노트 내 AI 버튼을 누르면 '자동 서식' 버튼이 뜨고요. 여기서 '제목 및 글머리 기호', 혹은 '회의 노트'를 선택할 수 있습니다. 기사 내용을 복사해 붙여 넣고 '제목 및 글머리 기호'를 누르니 AI가 텍스트를 정리해 여러 서식으로 만들어줬습니다. 이중 원하는 서식을 선택해 저장하면 되는 거죠.기존 갤럭시 폰에서는 AI를 통해 사진 편집 기능을 활용할 수 있었는데요. 이 역시 갤럭시 AI를 통해 조금 더 고도화됐습니다. 생성형 AI를 기반으로 새롭게 선보이는 '생성형 편집' 기능 덕분인데요. 촬영한 사진을 보다 보면 사진이 기울어져 수평이 맞지 않는 경우가 많은데요. 이를 조정하기 위해서는 사진의 테두리, 즉 피사체의 배경이 잘릴 수밖에 없습니다. 혹은 원하는 배경이 전부 담기지 않게 촬영된 사진이 있을 수도 있고요.



생성형 편집 기능을 활용해 사진을 편집하는 모습. /영상=백유진 기자 byj@갤럭시S24의 생성형 편집은 AI가 사물의 일부 이미지를 메꿔 이런 고민을 해결해 줍니다. 잘려 나간 이미지를 수많은 데이터로 추론해 적절하게 메워주는 것인데요. 이밖에 사진 내 피사체를 이동하거나 크기를 조정하는 것도 간편했습니다. 피사체를 길게 누르기만 하면 자동으로 외곽선을 구분해줍니다. 소위 말해 '누끼'를 따주는 거죠.특히 갤럭시 AI로 편집된 이미지에는 '워터마크'가 붙고요, 속성정보에도 '생성형 AI로 수정됨'이라는 문구가 표시됩니다. 해당 이미지가 AI에 생성 혹은 편집됐음을 확인할 수 있도록 하기 위함인데요.이에 대해 삼성전자 관계자는 ""생성형 AI가 만들어낸 이미지가 가짜뉴스 등에 악용될 우려가 있어 최근 여러 글로벌 국가에서 생성형 AI를 이용해 만든 이미지에 워터마크를 제공해야 한다는 의무를 규정하는 분위기""라며 ""국내는 아직 이런 규제가 없지만 이에 미리 대비하기 위해 워터마크를 넣게 됐다""고 설명했습니다.어떤가요. 삼성전자의 AI가 바꿀 미래가 가깝게 느껴지시나요? 삼성전자는 이런 갤럭시 AI 기능을 신제품에만 국한시키지 않고, 작년 출시된 제품까지 상반기 내 확대 적용할 계획인데요. AP(애플리케이션 프로세서) 등 제품의 하드웨어가 다르기 때문에 구형 모델에서는 신제품만한 성능을 느껴볼 수는 없겠지만, AI와 가까워진 느낌을 받기에는 충분할 것 같습니다.[테크따라잡기]는 한 주간 산업계 뉴스 속에 숨어 있는 기술을 쉽게 풀어드리는 비즈워치 산업부의 주말 뉴스 코너입니다. 빠르게 변하는 기술, 빠르게 잡아 드리겠습니다. [편집자]
",증권,"[테크따라잡기]'첫 AI폰' 갤럭시S24, 통화·메시지·노트 등 여러 AI 기능 더해져/그래픽=비즈워치삼성전자가 지난 18일 상반기 플래그십 스마트폰 '갤럭시 S24' 시리즈를 선보였죠. 삼성전자의 갤럭시 신제품 공개는 늘 화제가 되지만, 올해는 조금 특별했던 것 같습니다. 갤럭시S24가 최초의 'AI(인공지능) 스마트폰'을 표방했기 때문인데요.갤럭시S24는 삼성전자가 자체 개발한 '갤럭시 AI'가 탑재된 첫 스마트폰입니다. 이전까지 갤럭시 시리즈에 AI 기능이 없던 건 아니지만, 올해는 조금 더 획기적으로 개선된 모습이었는데요. 이번 주 테크따라잡기는 갤럭시S24의 AI 기능을 구체적으로 살펴보겠습니다.갤럭시S24 시리즈. 왼쪽부터 순서대로 울트라·플러스·일반 모델./사진=백유진 기자 byj@내 손안의 통역사갤럭시 AI의 가장 대표적인 역할은 '통역사'입니다. 삼성전자는 제품 공개에 앞서 이 기능을 선공개한 바 있는데요. 바로 '양방향 통역 서비스'입니다.통역 서비스는 통화와 메시지 모두 가능합니다. 삼성 기본 전화 앱(App)으로 전화를 걸면 통화 어시스트 버튼이 뜨고요. 여기서 실시간 통역을 누르면, 이 통화는 '실시간으로 번역되며 화면에 텍스트로 표시됩니다'라는 안내와 함께 통역이 시작됩니다.실제 삼성전자가 시연하는 것을 보니, 화자가 한국어로 얘기를 하면 영어로 자연스럽게 번역이 되더군요. 수신자에게는 발신자가 말하는 한국어가 영어로 통역돼 들린다고 합니다. 상대방의 스마트폰 기종이 갤럭시가 아닌 아이폰이어도 상관없다고 하고요. 다만 아직은 삼성 기본 전화 앱을 통해서만 가능하다고 하네요.갤럭시S24에서 한국어로 메시지를 입력하니 자동으로 스페인어로 번역됐다./영상=백유진 기자 byj@이와 달리 메시지 기능은 삼성 기본 메시지 앱이 아닌 카카오톡 같은 서드파티 앱에서도 활용 가능합니다. 메시지 번역 기능이 갤럭시 스마트폰에 기본 탑재된 '삼성 키보드'를 통해 구동되기 때문인데요.삼성 키보드에 새로 생긴 AI 버튼을 누르면 △대화 번역 △문장 스타일 △철자 및 문법 메뉴가 나옵니다. 여기서 대화 번역을 누르면 한국어로 입력한 문장이 자동으로 번역이 됩니다. 갤럭시로 통·번역 가능한 언어는 한국어를 비롯해 △중국어(간체) △영어 △프랑스어 △독일어 △힌디어 △이탈리아어 △일본어 △폴란드어 △포르투갈어 △스페인어 △태국어 △베트남어 등 13개입니다.갤럭시S24에서 삼성 키보드로 문구를 입력하면, 5가지 형태로 문장 스타일을 변경할 수 있다./영상=백유진 기자 byj@이뿐 아니라 메시지 내 문장 스타일을 바꿀 수도 있는데요. 원하는 내용을 작성한 뒤 문장 스타일을 누르면 갤럭시 AI가 △전문적인 △편안한 △소셜 △공손한 △이모지 추가 등 총 5가지 버전의 문장을 만들어줍니다. 소셜을 선택하면 SNS에 올리기 쉽도록 태그가 자동으로 달리고요, 이모지를 추가하면 내용에 맞는 적절한 이모티콘이 추가되는 식입니다.검색·편집도 'AI'가장 눈에 띄었던 기능은 '서클 투 서치'입니다. 이는 삼성전자와 구글과의 협력으로 탄생한 AI 기능인데요. 어느 화면에나 궁금한 부분에 동그라미를 그리면 갤럭시 AI는 이를 인식해 구글 검색으로 연동시켜 줍니다. 스마트폰을 사용하다가 궁금한 게 생겨도 검색창을 켜지 않고 해결이 가능해진 거죠.갤럭시S24에서 유튜브를 보다 캐릭터를 동그라미치니 자동으로 구글 검색이 됐다./영상=백유진 기자 byj@검색 내용도 AI가 가장 적합한 정보를 우선적으로 보여줍니다. 추가로 궁금한 게 있다면 AI에게 대화형으로 질문할 수도 있습니다. 이 역시 생성형 AI가 정리한 정보로 보여주죠. 예를 들어 볼까요? 인스타그램을 보다가 가고 싶은 랜드마크를 발견했는데, 장소 태그가 돼 있지 않은 경우가 있죠. 이럴 때 이미지에 동그라미를 치는 것만으로 랜드마크의 명칭과 위치를 알 수 있습니다. 이후 대화를 통해 후속 질문을 이어가며 해당 장소의 역사적 의미 등을 파악할 수 있죠.갤럭시S24로 삼성 노트에서 글을 편집하는 모습. '제목 및 글머리 기호'를 누르니 여러 서식이 만들어졌다./영상=백유진 기자 byj@'삼성 노트'에도 AI가 적용되며 여러 기능이 생겼는데요. 이중에서는 자동 서식을 맞춰주는 기능이 가장 새로웠습니다. 삼성 노트 내 AI 버튼을 누르면 '자동 서식' 버튼이 뜨고요. 여기서 '제목 및 글머리 기호', 혹은 '회의 노트'를 선택할 수 있습니다. 기사 내용을 복사해 붙여 넣고 '제목 및 글머리 기호'를 누르니 AI가 텍스트를 정리해 여러 서식으로 만들어줬습니다. 이중 원하는 서식을 선택해 저장하면 되는 거죠.기존 갤럭시 폰에서는 AI를 통해 사진 편집 기능을 활용할 수 있었는데요. 이 역시 갤럭시 AI를 통해 조금 더 고도화됐습니다. 생성형 AI를 기반으로 새롭게 선보이는 '생성형 편집' 기능 덕분인데요. 촬영한 사진을 보다 보면 사진이 기울어져 수평이 맞지 않는 경우가 많은데요. 이를 조정하기 위해서는 사진의 테두리, 즉 피사체의 배경이 잘릴 수밖에 없습니다. 혹은 원하는 배경이 전부 담기지 않게 촬영된 사진이 있을 수도 있고요.생성형 편집 기능을 활용해 사진을 편집하는 모습. /영상=백유진 기자 byj@갤럭시S24의 생성형 편집은 AI가 사물의 일부 이미지를 메꿔 이런 고민을 해결해 줍니다. 잘려 나간 이미지를 수많은 데이터로 추론해 적절하게 메워주는 것인데요. 이밖에 사진 내 피사체를 이동하거나 크기를 조정하는 것도 간편했습니다. 피사체를 길게 누르기만 하면 자동으로 외곽선을 구분해줍니다. 소위 말해 '누끼'를 따주는 거죠.특히 갤럭시 AI로 편집된 이미지에는 '워터마크'가 붙고요, 속성정보에도 '생성형 AI로 수정됨'이라는 문구가 표시됩니다. 해당 이미지가 AI에 생성 혹은 편집됐음을 확인할 수 있도록 하기 위함인데요.이에 대해 삼성전자 관계자는 ""생성형 AI가 만들어낸 이미지가 가짜뉴스 등에 악용될 우려가 있어 최근 여러 글로벌 국가에서 생성형 AI를 이용해 만든 이미지에 워터마크를 제공해야 한다는 의무를 규정하는 분위기""라며 ""국내는 아직 이런 규제가 없지만 이에 미리 대비하기 위해 워터마크를 넣게 됐다""고 설명했습니다.어떤가요. 삼성전자의 AI가 바꿀 미래가 가깝게 느껴지시나요? 삼성전자는 이런 갤럭시 AI 기능을 신제품에만 국한시키지 않고, 작년 출시된 제품까지 상반기 내 확대 적용할 계획인데요. AP(애플리케이션 프로세서) 등 제품의 하드웨어가 다르기 때문에 구형 모델에서는 신제품만한 성능을 느껴볼 수는 없겠지만, AI와 가까워진 느낌을 받기에는 충분할 것 같습니다.[테크따라잡기]는 한 주간 산업계 뉴스 속에 숨어 있는 기술을 쉽게 풀어드리는 비즈워치 산업부의 주말 뉴스 코너입니다. 빠르게 변하는 기술, 빠르게 잡아 드리겠습니다. [편집자]",positive,['삼성전자']
한국경제TV,2024.01.22. 오후 11:36,"영국 컴퍼스, 경쟁 외식업체 CH&CO 6억 달러에 인수","




영국 케이터링 회사 컴퍼스 그룹은 로열 오페라 하우스 케이터링 회사를 부채를 포함해 6억373만 달러에 인수하기로 합의했다고 22일(현지시간) 밝혔다.이는 유럽에서 지금까지 가장 큰 인수 금액을 기록했다.세계 최대 케이터링 그룹인 컴퍼스는 팬데믹에서 벗어나면서 볼트온 인수를 모색해 왔다.사모펀드 그룹 Equistone의 지원을 받는 CH&CO는 기업, 대학, 스포츠 및 기타 행사에 케이터링 서비스를 제공한다.런던의 로열 오페라 하우스, 애비 로드 스튜디오, 런던 큐의 로열 식물원 등이 있다.컴퍼스의 CEO 도미닉 블레이크모어는 성명을 통해 CH&CO의 강력한 브랜드 정체성이 회사가 시장에서 상당한 성장 잠재력을 활용할 수 있도록 할 것이라고 말했다.바클레이즈 분석가들은 ""우리는 23 회계연도에 잠재적으로 더 강력한 마진 역학을 상상할 수 있으며 컴퍼스와의 통합에 따른 뚜렷한 시너지 효과를 기대할 수 있을 것""이라고 밝혔다.그들은 ""올해 현금이 어떻게 소비될지 모르는 EPS 예측에 약간의 시간이 걸렸기 때문에 이번 거래 발표가 명확성을 제공하는 데 도움이 될 것""이라고 말했다.
",증권,"영국 케이터링 회사 컴퍼스 그룹은 로열 오페라 하우스 케이터링 회사를 부채를 포함해 6억373만 달러에 인수하기로 합의했다고 22일(현지시간) 밝혔다.이는 유럽에서 지금까지 가장 큰 인수 금액을 기록했다.세계 최대 케이터링 그룹인 컴퍼스는 팬데믹에서 벗어나면서 볼트온 인수를 모색해 왔다.사모펀드 그룹 Equistone의 지원을 받는 CH&CO는 기업, 대학, 스포츠 및 기타 행사에 케이터링 서비스를 제공한다.런던의 로열 오페라 하우스, 애비 로드 스튜디오, 런던 큐의 로열 식물원 등이 있다.컴퍼스의 CEO 도미닉 블레이크모어는 성명을 통해 CH&CO의 강력한 브랜드 정체성이 회사가 시장에서 상당한 성장 잠재력을 활용할 수 있도록 할 것이라고 말했다.바클레이즈 분석가들은 ""우리는 23 회계연도에 잠재적으로 더 강력한 마진 역학을 상상할 수 있으며 컴퍼스와의 통합에 따른 뚜렷한 시너지 효과를 기대할 수 있을 것""이라고 밝혔다.그들은 ""올해 현금이 어떻게 소비될지 모르는 EPS 예측에 약간의 시간이 걸렸기 때문에 이번 거래 발표가 명확성을 제공하는 데 도움이 될 것""이라고 말했다.",positive,"['컴', '##퍼스', '그룹', '케이', '##터', '##링']"
한국경제TV,2024.01.22. 오후 11:36,"보이스 AI 스타트업 일레븐랩스, 최근 자금 조달 후 유니콘 지위 획득","




인공지능 스타트업 일레븐랩스는 최근 자금 조달을 마친 후 유니콘 지위를 얻었다고 22일(현지시간) 소식통은 전했다.이는 생성 AI기술에 대한 투자자들의 관심이 급증하면서 스타트업 가치가 치솟고 있는 것이다.일레븐랩스는 월요일 벤처 투자가 안드레센 호로위츠와 기업가 냇 프리드먼, 다니엘 그로스와 함께 세쿼이아 캐피탈 등이 참여한 가운데 시리즈 B 자금 8천만 달러를 모았다고 밝혔다.2년된 이 회사는 가치 평가를 공개하지 않았지만 그 사람은 라운드에서 11억 달러의 가치를 평가하여 유니콘 또는 수십억 달러 규모의 스타트업이 되었다고 말했다.이는 피치북의 데이터에 따르면, 게임 대기업과 영화 스튜디오만큼 다양한 기업의 AI 음성 생성 채택 급증에 대한 기대를 반영하며 2023년경 이전 펀딩에서 1억 달러의 가치 평가에서 급증한 것이다.런던에 본사를 둔 일레븐랩스는 다른 언어, 억양 및 감정을 가진 인공지능 생성 음성을 만들기 위한 인공지능 모델 및 도구를 개발했다.전 세계적으로 약 40명의 원격 노동자를 고용하고 있으며 연말까지 100명으로 확대할 계획이라고 마티 스타니스제프스키 최고경영자가 로이터 통신에 말했다.
",증권,"인공지능 스타트업 일레븐랩스는 최근 자금 조달을 마친 후 유니콘 지위를 얻었다고 22일(현지시간) 소식통은 전했다.이는 생성 AI기술에 대한 투자자들의 관심이 급증하면서 스타트업 가치가 치솟고 있는 것이다.일레븐랩스는 월요일 벤처 투자가 안드레센 호로위츠와 기업가 냇 프리드먼, 다니엘 그로스와 함께 세쿼이아 캐피탈 등이 참여한 가운데 시리즈 B 자금 8천만 달러를 모았다고 밝혔다.2년된 이 회사는 가치 평가를 공개하지 않았지만 그 사람은 라운드에서 11억 달러의 가치를 평가하여 유니콘 또는 수십억 달러 규모의 스타트업이 되었다고 말했다.이는 피치북의 데이터에 따르면, 게임 대기업과 영화 스튜디오만큼 다양한 기업의 AI 음성 생성 채택 급증에 대한 기대를 반영하며 2023년경 이전 펀딩에서 1억 달러의 가치 평가에서 급증한 것이다.런던에 본사를 둔 일레븐랩스는 다른 언어, 억양 및 감정을 가진 인공지능 생성 음성을 만들기 위한 인공지능 모델 및 도구를 개발했다.전 세계적으로 약 40명의 원격 노동자를 고용하고 있으며 연말까지 100명으로 확대할 계획이라고 마티 스타니스제프스키 최고경영자가 로이터 통신에 말했다.",positive,"['일', '##레븐', '##랩', '##스', '##콘']"
한국경제TV,2024.01.22. 오후 11:09,"산도즈, 1억7천만 달러에 시멜리 인수","




산도즈는 시각 장애와 손실을 치료하는 바이오시밀러 의약품인 시멜리를 코헤러스 바이오사이언스로부터 1억7천만 달러에 인수하는 계약을 22일(현지시간) 발표했다.이 약은 로슈가 시판하는 제품인 루센티스와 교환 가능하며, 미국에서 제넨텍을, 노바티스가 승인된 모든 적응증에 대해 전 세계에서 새로운 탭을 연다고 산도즈는 말했다.바이오시밀러 의약품은 구조, 효능 및 안전성 측면에서 이미 승인된 다른 생물학적 의약품과 매우 유사한 생물학적 의약품이다.종종 생물학적 경쟁 제품보다 저렴하다.산도즈는 시멜리와 거래는 바이오의약품 허가 신청서, 제품 재고, 안과 판매 및 현장 상황 직원과 독점 상용 소프트웨어에 대한 엑세스가 포함된다고 말했다.케렌 하루비 산도즈 북미 사장은 ""성장하는 산도즈 바이오시밀러 포트폴리오에 또 다른 고부가가치 제품을 추가해 기존 안과 프랜차이즈를 더욱 강화할 수 있게 돼 기쁘다""고 말했다.
",증권,"산도즈는 시각 장애와 손실을 치료하는 바이오시밀러 의약품인 시멜리를 코헤러스 바이오사이언스로부터 1억7천만 달러에 인수하는 계약을 22일(현지시간) 발표했다.이 약은 로슈가 시판하는 제품인 루센티스와 교환 가능하며, 미국에서 제넨텍을, 노바티스가 승인된 모든 적응증에 대해 전 세계에서 새로운 탭을 연다고 산도즈는 말했다.바이오시밀러 의약품은 구조, 효능 및 안전성 측면에서 이미 승인된 다른 생물학적 의약품과 매우 유사한 생물학적 의약품이다.종종 생물학적 경쟁 제품보다 저렴하다.산도즈는 시멜리와 거래는 바이오의약품 허가 신청서, 제품 재고, 안과 판매 및 현장 상황 직원과 독점 상용 소프트웨어에 대한 엑세스가 포함된다고 말했다.케렌 하루비 산도즈 북미 사장은 ""성장하는 산도즈 바이오시밀러 포트폴리오에 또 다른 고부가가치 제품을 추가해 기존 안과 프랜차이즈를 더욱 강화할 수 있게 돼 기쁘다""고 말했다.",positive,"['산도', '##즈']"
한국경제TV,2024.01.22. 오후 10:52,"Adnoc, 탈탄소화 예산 230억 달러로 증액","
			아부다비 국영석유회사는 탈탄소화 프로젝트와 기술, 저탄소 접근법에 대한 예산을 늘렸다고 22일(현지시간) 밝혔다.국영 석유 가스 회사 이사회는 발표한 성명에 따르면 아드녹의 국내외 탄소 관리 플랫폼을 발전시키기 위한 투자를 포함하는 프로젝트에 230억 달러를 할당했다.아드녹 대변인은 새로운 예산은 이전의 2022년 12월 150억 달러의 예산 배정보다 증가한 것이라고 말했다.이 대변인은 다우존스 뉴스와이어스에 ""예산 증액은 지금부터 2030년까지의 기간을 포함한다""고 말했다.
",증권,"아부다비 국영석유회사는 탈탄소화 프로젝트와 기술, 저탄소 접근법에 대한 예산을 늘렸다고 22일(현지시간) 밝혔다.국영 석유 가스 회사 이사회는 발표한 성명에 따르면 아드녹의 국내외 탄소 관리 플랫폼을 발전시키기 위한 투자를 포함하는 프로젝트에 230억 달러를 할당했다.아드녹 대변인은 새로운 예산은 이전의 2022년 12월 150억 달러의 예산 배정보다 증가한 것이라고 말했다.이 대변인은 다우존스 뉴스와이어스에 ""예산 증액은 지금부터 2030년까지의 기간을 포함한다""고 말했다.",positive,"['아부', '##다', '##비', '##석']"
