source,date,title,documents,category,processed_text,sentiment_result,key_word
매일경제,2024.01.21. 오후 9:51,"청룡열차 못탄 홍콩증시…“ELS 원금손실 점입가경, 60% 육박”","
홍콩H지수 올들어 11% 급락기초자산 무너지며 손실폭 ↑상반기 손실액 최대 6조 달할듯



 금융감독원 앞에서 열린 홍콩H지수 ELS 피해자 집회. [사진 출처=연합뉴스]올해 들어 홍콩H지수(항셍중국기업지수)가 10% 넘게 급락하면서 이를 기초자산으로 삼는 주가연계증권(ELS) 손실이 60%에 육박할 정도로 커졌다. 투자자들이 집단 시위에 나서고 있고 금융당국도 불완전판매 등에 대한 조사에 나서면서 ELS 손실 공포가 확산되고 있다.21일 금융투자업계에 따르면 지난 17일이 만기일이었던 미래에셋증권의 ‘미래에셋증권(ELS) 29447’의 손실률은 56.05%로 확정됐다. 홍콩H지수 하락이 계속되다 보니 이보다 앞선 10일께 만기 평가일을 맞은 키움증권의 ‘제1528회파생결합증권(주가연계증권)’의 손실률 51.72%보다 더 높아졌다. 두 상품 모두 홍콩H지수를 기초자산 중 하나로 편입한 상품이다.ELS의 주요 판매창구인 은행에서는 실제 만기를 맞은 상품들의 손실 규모가 속속 드러나고 있다. 은행권에 따르면 5대 은행(KB국민·신한·하나·우리·NH농협)에서 판매된 홍콩H지수 ELS에서 올들어 19일까지 2296억원의 원금 손실이 발생했다. 올들어 지난 12일까지의 원금 손실액이 1067억원이었던 것을 감안하면 1주일새 1229억원이나 늘었다.



지난 8일부터 첫 원금 손실이 확정된 ELS 상품은 19일까지 원금 약4353억원 중 2057억원만 상환돼, 전체 손실률은 52.8%, 손실액은 2296억원인 것으로 집계됐다.새해 들어 홍콩H지수가 추가 하락하면서 ELS 원금 손실이 예상보다 더 커지고 있는 것이다. 홍콩H지수는 지난해 말 5768.5에서 19일 기준 5127.24로 올들어 11.12% 떨어졌다. 전세계 주요국 증시에서 올해 들어 하락률이 두자릿수인 것은 홍콩H지수가 유일하다.ELS는 만기 상환일에 기초자산의 가격을 평가해 수익률을 확정한다. 최근 홍콩H지수의 하락세가 가팔라 해당 지수를 기초자산으로 설정한 ELS의 원금 손실 규모도 덩달아 커지고 있는 것이다. 이 같이 손실이 커짐에 따라서 투자자들이 은행·증권사 등 판매사를 대상으로 불완전판매 등에 대한 불만의 목소리가 높아질 것으로 예상된다.
",증권,"홍콩H지수 올들어 11% 급락기초자산 무너지며 손실폭 ↑상반기 손실액 최대 6조 달할듯 금융감독원 앞에서 열린 홍콩H지수 ELS 피해자 집회. [사진 출처=연합뉴스]올해 들어 홍콩H지수(항셍중국기업지수)가 10% 넘게 급락하면서 이를 기초자산으로 삼는 주가연계증권(ELS) 손실이 60%에 육박할 정도로 커졌다. 투자자들이 집단 시위에 나서고 있고 금융당국도 불완전판매 등에 대한 조사에 나서면서 ELS 손실 공포가 확산되고 있다.21일 금융투자업계에 따르면 지난 17일이 만기일이었던 미래에셋증권의 ‘미래에셋증권(ELS) 29447’의 손실률은 56.05%로 확정됐다. 홍콩H지수 하락이 계속되다 보니 이보다 앞선 10일께 만기 평가일을 맞은 키움증권의 ‘제1528회파생결합증권(주가연계증권)’의 손실률 51.72%보다 더 높아졌다. 두 상품 모두 홍콩H지수를 기초자산 중 하나로 편입한 상품이다.ELS의 주요 판매창구인 은행에서는 실제 만기를 맞은 상품들의 손실 규모가 속속 드러나고 있다. 은행권에 따르면 5대 은행(KB국민·신한·하나·우리·NH농협)에서 판매된 홍콩H지수 ELS에서 올들어 19일까지 2296억원의 원금 손실이 발생했다. 올들어 지난 12일까지의 원금 손실액이 1067억원이었던 것을 감안하면 1주일새 1229억원이나 늘었다.지난 8일부터 첫 원금 손실이 확정된 ELS 상품은 19일까지 원금 약4353억원 중 2057억원만 상환돼, 전체 손실률은 52.8%, 손실액은 2296억원인 것으로 집계됐다.새해 들어 홍콩H지수가 추가 하락하면서 ELS 원금 손실이 예상보다 더 커지고 있는 것이다. 홍콩H지수는 지난해 말 5768.5에서 19일 기준 5127.24로 올들어 11.12% 떨어졌다. 전세계 주요국 증시에서 올해 들어 하락률이 두자릿수인 것은 홍콩H지수가 유일하다.ELS는 만기 상환일에 기초자산의 가격을 평가해 수익률을 확정한다. 최근 홍콩H지수의 하락세가 가팔라 해당 지수를 기초자산으로 설정한 ELS의 원금 손실 규모도 덩달아 커지고 있는 것이다. 이 같이 손실이 커짐에 따라서 투자자들이 은행·증권사 등 판매사를 대상으로 불완전판매 등에 대한 불만의 목소리가 높아질 것으로 예상된다.",negative,"['홍콩', '금융', '##당', '##국']"
스포츠서울,2024.01.21. 오후 8:31,홍콩H지수 추락에 ELS 손실률 56%까지 확대…손실 6조원대까지 불어날 수도,"




지난 19일 오후 서울 영등포구 여의도 금융감독원 앞에서 홍콩H지수(항셍중국기업지수) 기초 주가연계증권(ELS) 투자자들이 피해 보상 등을 촉구하고 있다. 사진 | 연합뉴스[스포츠서울 | 최규리 기자] 홍콩H지수(항셍중국기업지수)가 연일 하락하면서, 최근 만기 도래한 홍콩H지수 기초 주가연계증권(ELS)의 원금 손실률이 최고 56.1%까지 뛰었다.5대 은행이 판매한 홍콩H지수 ELS에서만 올해 들어 약 2300억원의 원금손실이 확정되는 등 투자자 손실이 눈덩이처럼 불어나는 분위기다.21일 은행권에 따르면 5대 은행(KB국민·신한·하나·우리·NH농협은행)에서 판매된 홍콩H지수 기초 ELS 상품에서 올해 들어 19일까지 2296억원의 원금 손실이 발생했다.5대 은행에서는 8일부터 첫 원금 손실이 확정됐는데, 11일 만에 손실액이 2000억원을 넘어선 셈이다.이 기간 만기 도래한 원금 약 4353억원 중 2057억원만 상환됐으며, 전체 손실률은 52.8%(손실액 2296억원)로 집계됐다.만기 일자마다 다르지만 일부 상품에서는 지난 17일 56.1% 손실률도 확인되는 등 손실률도 점점 커지고 있다.홍콩H지수 기초 ELS에서 원금 손실이 잇따르는 이유는 상품이 판매된 2021년 이후 홍콩H지수가 급락했기 때문이다.ELS는 기초자산으로 삼은 지수 등에 연계돼 투자수익이 결정되는데, 통상 6개월마다 기초자산 가격을 평가해 조기상환 기회를 주고, 만기 시 기초자산 가격이 일정 기준을 밑돌면 가격 하락률만큼 원금 손실이 발생한다.홍콩H지수는 홍콩 증시에 상장된 중국 기업 가운데 50개 종목을 추려서 산출하는 지수로, 변동성이 높은 것이 특징이다.홍콩H지수는 2021년 2월 1만2000선을 넘어섰으나 그 해 말 8000대까지 떨어진 뒤 현재 5100대까지 내렸다. 지난 2022년 10월 말에는 5000선이 무너지기도 했다.손실 규모는 앞으로 더 불어날 가능성이 크다. 홍콩H지수가 고점이던 2021년 판매된 상품들의 만기가 올해부터 속속 돌아올 예정이기 때문이다.금융감독원에 따르면 지난해 11월 15일 기준 홍콩H지수 기초 ELS 총판매 잔액은 19조3000억원으로, 이 중 15조9천억원을 은행에서 판매했다.전체 잔액의 79.6%인 15조4000억원의 만기가 올해 도래하는데, 올해 상반기(1분기 3조9000억원·2분기 6조3000억원)에 만기가 집중돼있다.ELS 상품 구조를 고려하면, 올해 상반기 홍콩H지수가 2021년 상반기의 65∼70% 수준은 돼야 원금손실을 피할 수 있다.2021년 상반기 홍콩H지수가 종가 기준으로 대략 1만340∼1만2229 범위에서 움직였고 현재는 5000대라는 점을 고려하면 홍콩H지수가 큰 폭으로 반등하지 않는 한 원금 손실이 불가피하다.지금 추세대로 손실률이 60% 수준까지 오른다고 하면, 5대 은행에서 판매한 홍콩H지수 관련 ELS의 원금 손실 규모는 상반기에만 6조원을 넘어설 수도 있다.금융당국은 홍콩H지수 연계 ELS 주요 판매사 12곳(KB국민·신한·하나·NH농협·SC제일은행, 한국투자·미래에셋·삼성·KB·NH·키움·신한투자증권)에 대해 현장검사를 실시하고, 불완전 판매 여부 등을 파악할 방침이다.gyuri@sportsseoul.com
",증권,"지난 19일 오후 서울 영등포구 여의도 금융감독원 앞에서 홍콩H지수(항셍중국기업지수) 기초 주가연계증권(ELS) 투자자들이 피해 보상 등을 촉구하고 있다. 사진 | 연합뉴스[스포츠서울 | 최규리 기자] 홍콩H지수(항셍중국기업지수)가 연일 하락하면서, 최근 만기 도래한 홍콩H지수 기초 주가연계증권(ELS)의 원금 손실률이 최고 56.1%까지 뛰었다.5대 은행이 판매한 홍콩H지수 ELS에서만 올해 들어 약 2300억원의 원금손실이 확정되는 등 투자자 손실이 눈덩이처럼 불어나는 분위기다.21일 은행권에 따르면 5대 은행(KB국민·신한·하나·우리·NH농협은행)에서 판매된 홍콩H지수 기초 ELS 상품에서 올해 들어 19일까지 2296억원의 원금 손실이 발생했다.5대 은행에서는 8일부터 첫 원금 손실이 확정됐는데, 11일 만에 손실액이 2000억원을 넘어선 셈이다.이 기간 만기 도래한 원금 약 4353억원 중 2057억원만 상환됐으며, 전체 손실률은 52.8%(손실액 2296억원)로 집계됐다.만기 일자마다 다르지만 일부 상품에서는 지난 17일 56.1% 손실률도 확인되는 등 손실률도 점점 커지고 있다.홍콩H지수 기초 ELS에서 원금 손실이 잇따르는 이유는 상품이 판매된 2021년 이후 홍콩H지수가 급락했기 때문이다.ELS는 기초자산으로 삼은 지수 등에 연계돼 투자수익이 결정되는데, 통상 6개월마다 기초자산 가격을 평가해 조기상환 기회를 주고, 만기 시 기초자산 가격이 일정 기준을 밑돌면 가격 하락률만큼 원금 손실이 발생한다.홍콩H지수는 홍콩 증시에 상장된 중국 기업 가운데 50개 종목을 추려서 산출하는 지수로, 변동성이 높은 것이 특징이다.홍콩H지수는 2021년 2월 1만2000선을 넘어섰으나 그 해 말 8000대까지 떨어진 뒤 현재 5100대까지 내렸다. 지난 2022년 10월 말에는 5000선이 무너지기도 했다.손실 규모는 앞으로 더 불어날 가능성이 크다. 홍콩H지수가 고점이던 2021년 판매된 상품들의 만기가 올해부터 속속 돌아올 예정이기 때문이다.금융감독원에 따르면 지난해 11월 15일 기준 홍콩H지수 기초 ELS 총판매 잔액은 19조3000억원으로, 이 중 15조9천억원을 은행에서 판매했다.전체 잔액의 79.6%인 15조4000억원의 만기가 올해 도래하는데, 올해 상반기(1분기 3조9000억원·2분기 6조3000억원)에 만기가 집중돼있다.ELS 상품 구조를 고려하면, 올해 상반기 홍콩H지수가 2021년 상반기의 65∼70% 수준은 돼야 원금손실을 피할 수 있다.2021년 상반기 홍콩H지수가 종가 기준으로 대략 1만340∼1만2229 범위에서 움직였고 현재는 5000대라는 점을 고려하면 홍콩H지수가 큰 폭으로 반등하지 않는 한 원금 손실이 불가피하다.지금 추세대로 손실률이 60% 수준까지 오른다고 하면, 5대 은행에서 판매한 홍콩H지수 관련 ELS의 원금 손실 규모는 상반기에만 6조원을 넘어설 수도 있다.금융당국은 홍콩H지수 연계 ELS 주요 판매사 12곳(KB국민·신한·하나·NH농협·SC제일은행, 한국투자·미래에셋·삼성·KB·NH·키움·신한투자증권)에 대해 현장검사를 실시하고, 불완전 판매 여부 등을 파악할 방침이다.gyuri@sportsseoul.com",negative,[]
스포츠서울,2024.01.21. 오후 8:31,홍콩H지수 전세계 하락률 1위…ELS 손실 쓰나미가 온다,"




지난 19일 오후 서울 영등포구 여의도 금융감독원 앞에서 홍콩H지수(항셍중국기업지수) 기초 주가연계증권(ELS) 투자자들이 피해 보상 등을 촉구하며 삭발하고 있다. 사진 | 연합뉴스[스포츠서울 | 최규리 기자] 새해부터 홍콩H지수(항셍중국기업지수)가 10% 넘게 급락하면서 3년 전 발행된 홍콩 H지수 주가연계증권(ELS)에 투자한 투자자들은 원금의 절반도 건지지 못하는 경우가 속출하고 있다.증권가에서도 홍콩H지수 약세 장기화가 이례적이라는 평가가 나오는 가운데 당장 지수가 반등할 모멘텀을 찾을 수 없어 투자자들의 손실 확대가 우려되는 상황이다.21일 금융정보업체 연합인포맥스에 따르면 홍콩H지수는 연초 이후 11.12% 급락해 전 세계 주가지수 가운데 가장 부진한 것으로 나타났다. 두 자릿수 하락률을 기록한 건 홍콩 H지수가 거의 유일했다.약세를 거듭했던 한국(코스피·-6.87%)은 물론, 경기 침체를 겪고 있는 중국(상하이종합지수·-4.80%)과 전쟁 중인 이스라엘(-3.12%)보다도 낮았다.홍콩H지수는 올해 단 3거래일을 제외하고 모두 하락했다. 중국이 부진한 부동산·내수 경기 지표를 발표한 17일에는 3.94% 급락했다.홍콩H지수가 큰 폭으로 떨어지면서 이를 기초자산으로 삼은 ELS의 만기 손실률도 60%에 육박하는 등 비상에 걸렸다.ELS는 만기 상환일에 기초자산의 가격을 평가해 수익률을 확정하는데, 홍콩H지수가 떨어질수록 해당 지수를 기초자산으로 설정한 ELS의 원금 손실 규모도 커지게 된다.금융투자업계에 따르면 홍콩H지수 ELS 손실률은 최근 일주일 만에 5%포인트(p)가량 확대됐다.이달 10일께 만기 평가일을 맞은 키움증권의 ‘제1528회파생결합증권(주가연계증권)’은 손실률이 51.72%였지만, 지난 17일이 만기일이었던 미래에셋증권의 ‘미래에셋증권(ELS) 29447’은 손실률이 56.05%로 확정됐다. 두 상품은 모두 홍콩H지수를 기초자산 중 하나로 편입했다.지난 16일이 만기 평가일이었던 한국투자증권의 홍콩H지수 연계 ‘TRUE ELS 제13599회(스텝다운)’도 만기 수익률이 55.06%로 확정됐다.올해 1분기 홍콩H지수 ELS 만기 금액이 매일 수백억 원씩 예정돼 있지만, 지수가 반등할 만한 호재를 찾기는 쉽지 않은 상황이다.유안타증권에 따르면 홍콩H지수 연계 ELS는 1월에만 일평균 483억원의 만기가 예정돼 있으며, 2∼3월에는 만기 상환 예정 금액이 2000억∼3000억원에 달하는 날도 있다.상반기(1∼6월) 만기 상환 금액은 10조원 수준이며, 월별로 보면 4월이 2조5553억원으로 가장 많다.전종규 삼성증권 연구원은 “홍콩 증시의 장기 조정 사이클은 글로벌 사례와 비교해도 이례적인 케이스”라며 1980년 이후 한국, 미국, 일본의 주가지수 조정 사이클은 길어야 3년이었다는 점을 고려하면 2020년부터 4년 연속 약세를 보인 홍콩H지수는 극히 드문 경우라고 짚었다.전문가들은 중화권 증시 부진은 미·중 갈등 장기화와 중국 경기 침체, 재정지출 확대·통화 완화 같은 정책의 부재, 글로벌 자금의 탈중국 흐름 심화 등 여러 복합적인 요인이 얽혀 있어 단기간에 유의미한 반등을 이뤄내기는 쉽지 않다고 지적한다.박상현 하이투자증권 연구원은 “중국 내부적으로나 정책적으로나, 외국인 자금 흐름으로나 H지수가 돌아서기가 쉽지 않다”며 “중국이 경기 부양을 하거나 자금을 투입해서 증시를 떠받치는 것 이상으로는 별 방법이 없을 것”이라고 말했다.gyuri@sportsseoul.com
",증권,"지난 19일 오후 서울 영등포구 여의도 금융감독원 앞에서 홍콩H지수(항셍중국기업지수) 기초 주가연계증권(ELS) 투자자들이 피해 보상 등을 촉구하며 삭발하고 있다. 사진 | 연합뉴스[스포츠서울 | 최규리 기자] 새해부터 홍콩H지수(항셍중국기업지수)가 10% 넘게 급락하면서 3년 전 발행된 홍콩 H지수 주가연계증권(ELS)에 투자한 투자자들은 원금의 절반도 건지지 못하는 경우가 속출하고 있다.증권가에서도 홍콩H지수 약세 장기화가 이례적이라는 평가가 나오는 가운데 당장 지수가 반등할 모멘텀을 찾을 수 없어 투자자들의 손실 확대가 우려되는 상황이다.21일 금융정보업체 연합인포맥스에 따르면 홍콩H지수는 연초 이후 11.12% 급락해 전 세계 주가지수 가운데 가장 부진한 것으로 나타났다. 두 자릿수 하락률을 기록한 건 홍콩 H지수가 거의 유일했다.약세를 거듭했던 한국(코스피·-6.87%)은 물론, 경기 침체를 겪고 있는 중국(상하이종합지수·-4.80%)과 전쟁 중인 이스라엘(-3.12%)보다도 낮았다.홍콩H지수는 올해 단 3거래일을 제외하고 모두 하락했다. 중국이 부진한 부동산·내수 경기 지표를 발표한 17일에는 3.94% 급락했다.홍콩H지수가 큰 폭으로 떨어지면서 이를 기초자산으로 삼은 ELS의 만기 손실률도 60%에 육박하는 등 비상에 걸렸다.ELS는 만기 상환일에 기초자산의 가격을 평가해 수익률을 확정하는데, 홍콩H지수가 떨어질수록 해당 지수를 기초자산으로 설정한 ELS의 원금 손실 규모도 커지게 된다.금융투자업계에 따르면 홍콩H지수 ELS 손실률은 최근 일주일 만에 5%포인트(p)가량 확대됐다.이달 10일께 만기 평가일을 맞은 키움증권의 ‘제1528회파생결합증권(주가연계증권)’은 손실률이 51.72%였지만, 지난 17일이 만기일이었던 미래에셋증권의 ‘미래에셋증권(ELS) 29447’은 손실률이 56.05%로 확정됐다. 두 상품은 모두 홍콩H지수를 기초자산 중 하나로 편입했다.지난 16일이 만기 평가일이었던 한국투자증권의 홍콩H지수 연계 ‘TRUE ELS 제13599회(스텝다운)’도 만기 수익률이 55.06%로 확정됐다.올해 1분기 홍콩H지수 ELS 만기 금액이 매일 수백억 원씩 예정돼 있지만, 지수가 반등할 만한 호재를 찾기는 쉽지 않은 상황이다.유안타증권에 따르면 홍콩H지수 연계 ELS는 1월에만 일평균 483억원의 만기가 예정돼 있으며, 2∼3월에는 만기 상환 예정 금액이 2000억∼3000억원에 달하는 날도 있다.상반기(1∼6월) 만기 상환 금액은 10조원 수준이며, 월별로 보면 4월이 2조5553억원으로 가장 많다.전종규 삼성증권 연구원은 “홍콩 증시의 장기 조정 사이클은 글로벌 사례와 비교해도 이례적인 케이스”라며 1980년 이후 한국, 미국, 일본의 주가지수 조정 사이클은 길어야 3년이었다는 점을 고려하면 2020년부터 4년 연속 약세를 보인 홍콩H지수는 극히 드문 경우라고 짚었다.전문가들은 중화권 증시 부진은 미·중 갈등 장기화와 중국 경기 침체, 재정지출 확대·통화 완화 같은 정책의 부재, 글로벌 자금의 탈중국 흐름 심화 등 여러 복합적인 요인이 얽혀 있어 단기간에 유의미한 반등을 이뤄내기는 쉽지 않다고 지적한다.박상현 하이투자증권 연구원은 “중국 내부적으로나 정책적으로나, 외국인 자금 흐름으로나 H지수가 돌아서기가 쉽지 않다”며 “중국이 경기 부양을 하거나 자금을 투입해서 증시를 떠받치는 것 이상으로는 별 방법이 없을 것”이라고 말했다.gyuri@sportsseoul.com",negative,[]
MBN,2024.01.21. 오후 8:09,출구가 안 보인다…연초 홍콩H지수 전 세계 하락률 1위,"
			【 앵커멘트 】  올해 초부터 홍콩H지수가 10% 넘게 급락하면서 이와 연계한 ELS 상품의 손실률이 더욱 커질 전망입니다.  당장 5대 은행에서 판매된 홍콩 ELS 상품에서 올해 들어 2천억 원이 넘는 원금 손실이 발생한 것으로 확인됐습니다.  길기범 기자입니다.【 기자 】 올해 홍콩H지수의 차트 모습입니다.  3거래일을 제외하고 모두 하락했는데, 연초 5,700선이던 지수는 5,100대까지 떨어졌습니다. 새해 들어 11% 넘게 떨어진 건데, 약세를 거듭한 코스피나 전쟁 중인 이스라엘을 넘어 전 세계 주가지수 중 가장 부진한 기록입니다.   이로 인해 홍콩지수와 연계한 ELS 상품의 원금 손실도 본격화되고 있습니다. 5대 은행에서 판매한 ELS 상품은 벌써 2천억 원이 넘는 손실액이 발생했고, 손실률은 절반이 넘었습니다.  또, 내일(22일) 만기가 돌아오는 ELS 상품은 56%가 넘는 손실률을 확정해 손실액만 80억 원에 달합니다. ▶ 인터뷰 : 홍콩 ELS 가입자 (지난 19일)- ""힘들게 모은 재산을 원금 손실가능성이 있는 투자성격의 상품이라는 걸 이해했다면 결코 아무리 많은 이자를 준다고 해도 가입하지 않았을 것입니다.""  더 큰 문제는 홍콩지수가 고점이던 지난 2021년 판매된 상품들의 만기가 상반기에 다가온다는 점입니다.  상반기 만기 도래 금액만 9조 원에 달하는데, 이중 6조 원이 넘는 손실이 예상됩니다.▶ 인터뷰(☎) : 주원 / 현대경제연구원 연구실장- ""홍콩에 상장된 중국 기업들의 주가를 모아서 만들어낸 지수이기 때문에 중국 경제의 향방이 제일 중요한데…. (부채) 구조조정이 어느 정도 마무리될 때까지는 좀 회복되기 어렵고….""   금융당국이 12개 판매사에 대해 현장검사를 벌이고 있지만, 분쟁 조정과 보상까지는 상당한 시간이 걸릴 것으로 예상됩니다.  MBN 뉴스 길기범입니다.   영상취재 : 현기혁 VJ  영상편집 : 오혜진
",증권,"【 앵커멘트 】  올해 초부터 홍콩H지수가 10% 넘게 급락하면서 이와 연계한 ELS 상품의 손실률이 더욱 커질 전망입니다.  당장 5대 은행에서 판매된 홍콩 ELS 상품에서 올해 들어 2천억 원이 넘는 원금 손실이 발생한 것으로 확인됐습니다.  길기범 기자입니다.【 기자 】 올해 홍콩H지수의 차트 모습입니다.  3거래일을 제외하고 모두 하락했는데, 연초 5,700선이던 지수는 5,100대까지 떨어졌습니다. 새해 들어 11% 넘게 떨어진 건데, 약세를 거듭한 코스피나 전쟁 중인 이스라엘을 넘어 전 세계 주가지수 중 가장 부진한 기록입니다.   이로 인해 홍콩지수와 연계한 ELS 상품의 원금 손실도 본격화되고 있습니다. 5대 은행에서 판매한 ELS 상품은 벌써 2천억 원이 넘는 손실액이 발생했고, 손실률은 절반이 넘었습니다.  또, 내일(22일) 만기가 돌아오는 ELS 상품은 56%가 넘는 손실률을 확정해 손실액만 80억 원에 달합니다. ▶ 인터뷰 : 홍콩 ELS 가입자 (지난 19일)- ""힘들게 모은 재산을 원금 손실가능성이 있는 투자성격의 상품이라는 걸 이해했다면 결코 아무리 많은 이자를 준다고 해도 가입하지 않았을 것입니다.""  더 큰 문제는 홍콩지수가 고점이던 지난 2021년 판매된 상품들의 만기가 상반기에 다가온다는 점입니다.  상반기 만기 도래 금액만 9조 원에 달하는데, 이중 6조 원이 넘는 손실이 예상됩니다.▶ 인터뷰(☎) : 주원 / 현대경제연구원 연구실장- ""홍콩에 상장된 중국 기업들의 주가를 모아서 만들어낸 지수이기 때문에 중국 경제의 향방이 제일 중요한데…. (부채) 구조조정이 어느 정도 마무리될 때까지는 좀 회복되기 어렵고….""   금융당국이 12개 판매사에 대해 현장검사를 벌이고 있지만, 분쟁 조정과 보상까지는 상당한 시간이 걸릴 것으로 예상됩니다.  MBN 뉴스 길기범입니다.   영상취재 : 현기혁 VJ  영상편집 : 오혜진",negative,[]
